{
  "schemaVersion": "cmc-skill-hub-fixture-v1",
  "provider": "fixtureProvider",
  "skill": "daily_market_overview",
  "status": "ok",
  "generatedAt": "2026-05-28T00:00:00.000Z",
  "market_read": {
    "regime": "mixed_transition",
    "conviction": 0.68,
    "summary": "BTC remains the primary signal; ETH and SOL need confirmation from volume and on-chain activity."
  },
  "watchlist": [
    {
      "symbol": "BTC",
      "name": "Bitcoin",
      "priceUSD": 109500,
      "percentChange24h": 1.8,
      "volume24hUSD": 42000000000,
      "marketCapUSD": 2160000000000,
      "risk": "medium",
      "evidence": "Fixture CMC daily market overview keeps BTC in focus."
    },
    {
      "symbol": "ETH",
      "name": "Ethereum",
      "priceUSD": 3920,
      "percentChange24h": 2.4,
      "volume24hUSD": 18500000000,
      "marketCapUSD": 472000000000,
      "risk": "medium",
      "evidence": "Fixture CMC regime context shows ETH participation improving."
    },
    {
      "symbol": "SOL",
      "name": "Solana",
      "priceUSD": 181,
      "percentChange24h": -0.7,
      "volume24hUSD": 4100000000,
      "marketCapUSD": 84000000000,
      "risk": "medium",
      "evidence": "Fixture CMC watchlist marks SOL as discussion-driven but not confirmed."
    }
  ],
  "action_guidance": [
    "Use as research context only.",
    "Cross-check WeChat discussion spikes with market freshness before adding tasks.",
    "Do not generate trade or send-message actions."
  ],
  "freshness_note": "Fixture generated for local smoke tests; live CMC MCP requires explicit connector configuration."
}
